{
	"id": "https://www.elixir-europe.org/excelerate/WP2/json-schemas/0.3/Tool",
	"$schema": "http://json-schema.org/draft-04/hyper-schema#",
	"title": "Tool concept (ELIXIR-EXCELERATE WP2 Benchmarking schemas)",
	"type": "object",
	"properties": {
		"_id": {
			"title": "The unique id of the tool. It should be something meaningful, like the tool name, its uri or an acronym",
			"type": "string",
			"minLength": 1
		},
		"_schema": {
			"title": "The JSON schema absolute URI. It must match the value of 'id' in the JSON schema",
			"type": "string",
			"format": "uri",
			"enum": [ "https://www.elixir-europe.org/excelerate/WP2/json-schemas/0.3/Tool" ]
		},
		"bioTools_id": {
			"title": "The unique id of the tool in EXCELERATE WP1 bio.tools registry",
			"type": "string",
			"format": "uri"
		},
		"name": {
			"title": "Short tool name",
			"minLength": 1,
			"type": "string"
		},
		"description": {
			"title": "Long tool name or description",
			"type": "string"
		},
		"is_automated": {
			"title": "Can this tool be automatically invoked?",
			"type": "boolean"
		},
		"community_id": {
			"title": "The community id(s) where this tool belongs",
			"type": "array",
			"minLength": 1,
			"items": {
				"type": "string",
				"foreign_keys": [
					{
						"schema_id": "Community",
						"members": [ "." ]
					}
				],
				"minLength": 1
			}
		},
		"tool_contact_id": {
			"title": "The tool's contact id(s)",
			"type": "array",
			"minLength": 1,
			"items": {
				"type": "string",
				"foreign_keys": [
					{
						"schema_id": "Contact",
						"members": [ "." ]
					}
				],
				"minLength": 1
			}
		},
		"status_id": {
			"title": "_id of the current tool status",
			"type": "string",
			"foreign_keys": [
				{
					"schema_id": "ToolStatus",
					"members": [ "." ]
				}
			],
			"minLength": 1
		},
		"references": {
			"title": "The tool's reference id(s)",
			"type": "array",
			"minLength": 1,
			"items": {
				"type": "string",
				"foreign_keys": [
					{
						"schema_id": "Reference",
						"members": [ "." ]
					}
				],
				"minLength": 1
			}
		},
		"tool_access": {
			"title": "Methods to access the tool",
			"type": "array",
			"minLength": 1,
			"items": {
				"type": "object",
				"properties": {
					"tool_access_type_id": {
						"title": "The tool access type id",
						"type": "string",
						"foreign_keys": [
							{
								"schema_id": "ToolAccessType",
								"members": [ "." ]
							}
						],
						"minLength": 1
					},
					"link": {
						"title": "The base link to the access point (when it is not a local algorithm)",
						"type": "string",
						"format": "uri"
					},
					"techdocs": {
						"title": "Optional technical documentation of the tool access",
						"type": "array",
						"items": {
							"type": "object",
							"properties": {
								"uri": {
									"title": "The URI of the technical documentation",
									"type": "string",
									"format": "uri"
								},
								"label": {
									"title": "The type of URI (WSDL, WADL, OpenAPI/Swagger, Source code, Miscellaneous documentation)",
									"type": "string",
									"enum": ["WSDL","WADL","OpenAPI","API","source","doc"]
								}
							},
							"additionalProperties": false,
							"required": [
								"uri",
								"label"
							]
						}
					}
				},
				"additionalProperties": true,
				"required": [
					"tool_access_type_id"
				]
			}
		}
	},
	"additionalProperties": true,
	"required": ["_id","_schema","name","is_automated","community_id","tool_contact_id","status_id","tool_access"],
	"primary_key": ["_id"],
	"dependencies": {}
}
