{
    "_id": "SymmDock",
    "_schema": "https://www.elixir-europe.org/excelerate/WP2/json-schemas/0.3/Tool",
    "bioTools_id": "SymmDock",
    "name": "SymmDock",
    "description": "SymmDock is an server for prediction of complexes with cyclically symmetry by geometry based molecular docking.",
    "is_automated": true,
    "community_id":
      [
        "CAPRI" 
      ],
    "tool_contact_id": [
      "Dina.Schneidman-Duhovny"
    ],
    "status_id": "active",
    "references": [
      "10.1093/nar/gki481"
    ],
    "tool_access": 
      [
        {
          "tool_access_type_id":"Web/API",
          "link":"http://bioinfo3d.cs.tau.ac.il/SymmDock/"
        }
      ]
}
