{
	"_id": "QfO:EggNOG",
	"_schema": "https://www.elixir-europe.org/excelerate/WP2/json-schemas/0.3/Tool",
	"name": "EggNOG",
	"description": "A database of orthologous groups and functional annotation",
	"is_automated": true,
	"community_id": ["QfO:QfO"],
	"tool_contact_id": [
		"Jaime.Huerta-Cepas"
	],
	"status_id": "QfO:active",
	"references": [
		"10.1093/nar/gkv1248",
		"10.1093/nar/gkt1253",
		"10.1093/nar/gkr1060",
		"10.1093/nar/gkp951",
		"10.1093/nar/gkm796"
	],
	"tool_access": [
		{
			"tool_access_type_id": "QfO:RESTful-Web-API",
			"link": "http://eggnogapi.embl.de/nog_data/",
			"techdocs": [
				{
					"uri": "http://eggnogdb.embl.de/#/app/api",
					"label": "WADL"
				}
			]
		}
	]
}
